{
  "schemaVersion": 1,
  "generatedAt": "2026-08-28T22:18:39.574Z",
  "expiresAt": "2026-08-29T00:18:39.574Z",
  "editorialPolicy": {
    "mission": "Entertain, educate and inform with freedom, creativity and humour; never optimise for anger or distress.",
    "geography": [
      "global",
      "uk",
      "us",
      "canada",
      "australia",
      "india",
      "china"
    ],
    "attributionRequired": true
  },
  "sources": [
    {
      "id": "google-trends-gb",
      "label": "Google Trends · United Kingdom",
      "state": "ok",
      "count": 10
    },
    {
      "id": "google-trends-us",
      "label": "Google Trends · United States",
      "state": "ok",
      "count": 10
    },
    {
      "id": "google-trends-ca",
      "label": "Google Trends · Canada",
      "state": "ok",
      "count": 10
    },
    {
      "id": "google-trends-au",
      "label": "Google Trends · Australia",
      "state": "ok",
      "count": 10
    },
    {
      "id": "google-trends-in",
      "label": "Google Trends · India",
      "state": "ok",
      "count": 10
    },
    {
      "id": "hacker-news",
      "label": "Hacker News",
      "state": "ok",
      "count": 29
    },
    {
      "id": "wikimedia-top",
      "label": "Wikimedia Pageviews",
      "state": "ok",
      "count": 60
    }
  ],
  "signals": [
    {
      "id": "hn-49478340",
      "type": "community-story",
      "headline": "Get your Windows license refund",
      "summary": "621 points · 253 comments",
      "url": "https://en.refund4freedom.org/",
      "publisher": "Hacker News",
      "sourceId": "hacker-news",
      "region": "global",
      "publishedAt": "2026-08-28T13:42:40.000Z",
      "momentum": 91,
      "tribeHints": [
        "global-curious",
        "builders-nerds",
        "entrepreneurs"
      ],
      "formats": [
        "article"
      ]
    },
    {
      "id": "hn-49479878",
      "type": "community-story",
      "headline": "GLM-5.3 is now open-weight",
      "summary": "515 points · 185 comments",
      "url": "https://huggingface.co/zai-org/GLM-5.3",
      "publisher": "Hacker News",
      "sourceId": "hacker-news",
      "region": "global",
      "publishedAt": "2026-08-28T15:20:13.000Z",
      "momentum": 89,
      "tribeHints": [
        "global-curious",
        "builders-nerds",
        "entrepreneurs"
      ],
      "formats": [
        "article"
      ]
    },
    {
      "id": "hn-49479837",
      "type": "community-story",
      "headline": "GUIs should be fully keyboard-driven",
      "summary": "469 points · 244 comments",
      "url": "https://ckardaris.com/blog/2026/08/28/keyboard-driven-guis.html",
      "publisher": "Hacker News",
      "sourceId": "hacker-news",
      "region": "global",
      "publishedAt": "2026-08-28T15:17:09.000Z",
      "momentum": 88,
      "tribeHints": [
        "global-curious",
        "builders-nerds",
        "entrepreneurs"
      ],
      "formats": [
        "article"
      ]
    },
    {
      "id": "hn-49478178",
      "type": "community-story",
      "headline": "Htmx 4.0",
      "summary": "434 points · 104 comments",
      "url": "https://four.htmx.org/announcements/2026-08-28-htmx-4.0.0-is-released",
      "publisher": "Hacker News",
      "sourceId": "hacker-news",
      "region": "global",
      "publishedAt": "2026-08-28T13:28:56.000Z",
      "momentum": 88,
      "tribeHints": [
        "global-curious",
        "builders-nerds",
        "entrepreneurs"
      ],
      "formats": [
        "article"
      ]
    },
    {
      "id": "hn-49473522",
      "type": "community-story",
      "headline": "Judge rules Trump administration’s blacklisting of Anthropic was illegal",
      "summary": "454 points · 337 comments",
      "url": "https://www.nytimes.com/2026/08/27/technology/anthropic-government-blacklisting-ruling.html",
      "publisher": "Hacker News",
      "sourceId": "hacker-news",
      "region": "global",
      "publishedAt": "2026-08-28T02:03:38.000Z",
      "momentum": 88,
      "tribeHints": [
        "global-curious",
        "builders-nerds",
        "entrepreneurs"
      ],
      "formats": [
        "article"
      ]
    },
    {
      "id": "hn-49477854",
      "type": "community-story",
      "headline": "U.S. sanctions against the A/I Collective",
      "summary": "418 points · 378 comments",
      "url": "https://www.inventati.org/",
      "publisher": "Hacker News",
      "sourceId": "hacker-news",
      "region": "global",
      "publishedAt": "2026-08-28T12:58:53.000Z",
      "momentum": 87,
      "tribeHints": [
        "global-curious",
        "builders-nerds",
        "entrepreneurs"
      ],
      "formats": [
        "article"
      ]
    },
    {
      "id": "hn-49475079",
      "type": "community-story",
      "headline": "Luanti removed from Google Play due to baseless AI copyright notice",
      "summary": "398 points · 121 comments",
      "url": "https://blog.luanti.org/2026/08/27/luanti-dmca-tracer-ai/",
      "publisher": "Hacker News",
      "sourceId": "hacker-news",
      "region": "global",
      "publishedAt": "2026-08-28T06:33:57.000Z",
      "momentum": 87,
      "tribeHints": [
        "global-curious",
        "builders-nerds",
        "entrepreneurs"
      ],
      "formats": [
        "article"
      ]
    },
    {
      "id": "hn-49477564",
      "type": "community-story",
      "headline": "Inception-style curved map for turn-by-turn directions",
      "summary": "374 points · 126 comments",
      "url": "https://www.orbify.eu/demo/",
      "publisher": "Hacker News",
      "sourceId": "hacker-news",
      "region": "global",
      "publishedAt": "2026-08-28T12:29:05.000Z",
      "momentum": 86,
      "tribeHints": [
        "global-curious",
        "builders-nerds",
        "entrepreneurs"
      ],
      "formats": [
        "article"
      ]
    },
    {
      "id": "trend-us-009686dc36b92623035d8865",
      "type": "search-trend",
      "headline": "dodgers vs tigers",
      "summary": "As Tarik Skubal returns, Tigers cycling back into development mode",
      "url": "https://www.detroitnews.com/story/sports/mlb/tigers/2026/08/28/as-tarik-skubal-returns-tigers-cycling-back-into-development-mode/91487011007/",
      "publisher": "Google Trends",
      "sourceId": "google-trends-us",
      "region": "us",
      "publishedAt": "2026-08-28T21:40:00.000Z",
      "momentum": 85,
      "tribeHints": [
        "global-curious"
      ],
      "formats": [
        "article",
        "image"
      ],
      "imageUrl": "https://encrypted-tbn2.gstatic.com/images?q=tbn:ANd9GcR4qZSQ2QFRjpXqtKnfHN6NeGQrEJ2m1DG_whuU0IgT3XWH0IIMERKplB9JJQY"
    },
    {
      "id": "hn-49476143",
      "type": "community-story",
      "headline": "Hilariously fast volume computation with the divergence theorem (2018)",
      "summary": "239 points · 64 comments",
      "url": "https://alyssarosenzweig.ca/blog/hilariously-fast-volume-computation-with-the-divergence-theorem.html",
      "publisher": "Hacker News",
      "sourceId": "hacker-news",
      "region": "global",
      "publishedAt": "2026-08-28T09:00:46.000Z",
      "momentum": 83,
      "tribeHints": [
        "global-curious",
        "builders-nerds",
        "entrepreneurs"
      ],
      "formats": [
        "article"
      ]
    },
    {
      "id": "trend-canada-8a75cd7cb1bc52e4c228787b",
      "type": "search-trend",
      "headline": "manitoba",
      "summary": "Canada adds more U.S. goods to list of planned counter-tariffs",
      "url": "https://globalnews.ca/news/12039115/canada-tweaks-list-counter-tariffs/",
      "publisher": "Google Trends",
      "sourceId": "google-trends-ca",
      "region": "canada",
      "publishedAt": "2026-08-28T22:10:00.000Z",
      "momentum": 82,
      "tribeHints": [
        "global-curious"
      ],
      "formats": [
        "article",
        "image"
      ],
      "imageUrl": "https://encrypted-tbn2.gstatic.com/images?q=tbn:ANd9GcQeEM7fg08fYicW0sV748mJyY0NB-wvT1G0Wom1O-XtEqK6LBxFu_Rk6ra4PuY"
    },
    {
      "id": "trend-canada-0c18ab298e885eb4fd9449df",
      "type": "search-trend",
      "headline": "cale makar",
      "summary": "Avalanche, Cale Makar agree to largest contract in NHL history",
      "url": "https://www.sportsnet.ca/nhl/article/avalanche-cale-makar-agree-to-largest-contract-in-nhl-history/",
      "publisher": "Google Trends",
      "sourceId": "google-trends-ca",
      "region": "canada",
      "publishedAt": "2026-08-28T21:30:00.000Z",
      "momentum": 82,
      "tribeHints": [
        "global-curious",
        "life-experienced"
      ],
      "formats": [
        "article",
        "image"
      ],
      "imageUrl": "https://encrypted-tbn0.gstatic.com/images?q=tbn:ANd9GcSRob4tlWi0-Vu25vN6Tpws1yUxrZUQ5Anou7mW0COhk-irbpbyS7g68Qabq24"
    },
    {
      "id": "hn-49480466",
      "type": "community-story",
      "headline": "Just the rumour of a bug is enough to find an exploit these days",
      "summary": "206 points · 71 comments",
      "url": "https://anil.recoil.org/notes/rumour-is-the-exploit",
      "publisher": "Hacker News",
      "sourceId": "hacker-news",
      "region": "global",
      "publishedAt": "2026-08-28T15:58:46.000Z",
      "momentum": 81,
      "tribeHints": [
        "global-curious",
        "builders-nerds",
        "entrepreneurs"
      ],
      "formats": [
        "article"
      ]
    },
    {
      "id": "hn-49472216",
      "type": "community-story",
      "headline": "The Twelve-Factor App (2025)",
      "summary": "199 points · 99 comments",
      "url": "https://12factor.net/",
      "publisher": "Hacker News",
      "sourceId": "hacker-news",
      "region": "global",
      "publishedAt": "2026-08-27T22:41:11.000Z",
      "momentum": 81,
      "tribeHints": [
        "global-curious",
        "builders-nerds",
        "entrepreneurs"
      ],
      "formats": [
        "article"
      ]
    },
    {
      "id": "hn-49483182",
      "type": "community-story",